index,sku,productId,name,new,regularPrice,salePrice,customerReviewCount,customerReviewAverage,freeShipping,onlineAvailability,onlineAvailabilityText,releaseDate,shippingCost,shortDescription,manufacturer,inStorePickup,esrbRating,longDescription,onlineAvailability_notAvailable,onlineAvailability_preOrder,onlineAvailability_soldOut,onlineAvailability_businessDay1,onlineAvailability_businessDay12,esrb_everyone10,esrb_everyone,esrb_mature,esrb_pending,esrb_teen,genre,esrb_description
661,9064077,1.21801E+12,Tomb Raider: Underworld,0,14.99,14.99,3,4.3,0,0,Shipping: Not available,11/19/2008,,unravel secret behind mythic power made real,Eidos Interactive,0,T=Teen,learn tomb raider underworld xbox 360 flash demo synopsisfor thousand year myth thor hammer persist accord legend whoever wield nors god weapon hold power smash mountain valley even destroy god lara croft explor ancient ruin floor mediterranean sea yield evid endur myth mythic thrust race time unravel secret behind stori prevent exploit power beyond human imagin abl find way truth time forgotten power unleash lay wast civil prepar epic adventur compani inimit lara croft tomb raider underworld journey far flung corner globe explor ancient mysteri underworld make power acrobat abil master whatev environ find seiz courag appli cun navig way lara world conquer elabor multistag puzzl complet level help fame adventur overcom challeng path get heart mysteri time run entir world forfeit terribl power,1,0,0,0,0,0,0,0,0,1,action adventur,blood mild languag mild suggest theme violenc
662,9092206,1.21802E+12,Mirror's Edge,0,9.99,9.99,30,4.8,1,1,Shipping: Usually ships in 1-2 business days,11/12/2008,0,run life,Electronic Arts,1,T=Teen,learn mirror edg xbox 360 flash demo synopsisin seem utopian citi tight rein place inform creat market new type profess agil courier call runner transport sensit data foot away pri eye runner name faith discov sister frame terribl crime soon find run reason entir unrel job caught sight unscrupul oppon determin hunt faith must run life soar vertigo induc cityscap abl outrun dead fate mirror edg thrust path danger combin chase puzzl strategi fierc combat run leap vault complex urban environ incred smooth acrobat movement lend immediaci heart pound action runner vision let view world perspect runner scan environ next mean escap scale wall leap across rooftop strive evad danger know continu movement feet thing keep aliv,0,0,0,0,1,0,0,0,0,1,action adventur,blood languag violenc
663,9092563,1.21802E+12,Mortal Kombat vs. DC Universe Platinum Hits,0,19.99,19.99,40,3.9,1,1,Shipping: Usually leaves our warehouse in 1 business day,11/16/2008,0,triumph epic showdown two power univers,Midway,1,T=Teen,learn mortal kombat vs dc univers flash demo synopsislegendari hero brutal warrior collid like never dc comic mortal kombat univers popul amaz charact engag epic struggl supremaci cataclysm forc fuse two world togeth result conflict unlik anyth either world ever seen join battl mortal kombat warrior dc superhero clash showdown age choos side enter fray mortal kombat vs dc univers bring togeth familiar figur incred fight adventur pit like batman superman scorpion sub zero make use charact signatur fight style neutral enemi distinct finish move evok true mortal kombat experi two new fight mechan give even opportun savor conflict freefal kombat allow amaz mid air battl klose kombat permit zero fight astonish close view soar height metropoli gotham citi eeri realm graveyard hell battl two power forc shake univers foundat deliv unforgett fight experi,0,0,0,1,0,0,0,0,0,1,fight,blood suggest theme violenc
664,9122683,1.21803E+12,Prince of Persia,0,19.99,19.99,13,3.6,1,1,Shipping: Usually ships in 1-2 business days,12/3/2008,0,spring action legendari rogu warrior,Ubisoft Entertainment,1,T=Teen,learn princ persia xbox 360 flash demo synopsistravel land rich magic mystic world ancient persia unfold princ persia fabl princ rogu warrior astonish acrobat strateg talent arm unrival agil devast fight tactic prepar swing canyon scale side build perform perfect time acrobat combin strive rid homeland dark corrupt return persia peac prosper stori franchis return deliv entir new action adventur experi princ persia explor magnific open world allow freedom select path determin game evolv experi excit new combat system battl ahriman corrupt lieuten join forc gift elika dynam artifici intellig companion magic power enhanc abil special duo acrobat move devast fight combo attack put strength speed strategi test whirl action struggl uproot evil taken hold land,0,0,0,0,1,0,0,0,0,1,action adventur,alcohol refer mild languag mild suggest theme violenc
670,9166742,1.21804E+12,Street Fighter IV Platinum Hits,0,19.99,19.99,24,4.3,1,1,Shipping: Usually ships in 1-2 business days,2/18/2009,0,domin martial art scene intens new move,Capcom,0,T=Teen,learn street fighter iv flash demo synopsisreturn adrenalin fuel world street show move instreet fighter iv latest instal stori fight franchis combin classic game mechan love thrill new gameplay system design challeng new fan season devote swing action execut amaz martial art move design help systemat destroy oppon street fighter iv encount mix classic charact includ ryu ken chun li well new fighter kickbox abel femal super spi crimson viper explor astonish locat never seen street fighter game 3d environ bring new depth intens martial art experi use game six button control unleash astonish new move includ focus attack super combo assert domin everi oppon encount,0,0,0,0,1,0,0,0,0,1,fight,alcohol refer mild suggest theme violenc
671,9166797,1.21804E+12,Resident Evil 5 Platinum Hits,0,19.99,19.99,77,4.3,1,1,Shipping: Usually ships in 1-2 business days,3/13/2009,0,daylight protect evil take hold,Capcom,0,M=Mature,learn resid evil 5 flash demo synopsisget readi new foray deepest fear remot african villag strang infect taken hold transform innoc villag ruthless abomin chris redfield veteran outbreak must embark new quest get root epidem evil along new partner african bsaa agent sheva alomar chris journey realm fill terrifi new threat danger new enemi evil lurk dark clear light day well resid evil 5 transport world face terror epic scale play either chris sheva put courag test go head head hord rampag enemi quest investig epidem wield incred new weapon help safeguard surviv sinist enemi arm increas speed intellig make danger ever join forc friend new two player onlin co op combin talent chris sheva help work togeth beat back terrifi infect fight surviv world gone mad,0,0,0,0,1,0,0,1,0,0,action adventur,blood gore intens violenc strong languag
672,9189415,1.21805E+12,Disney Sing It: High School Musical 3: Senior Year with Microphone,0,10.99,10.99,,,1,0,Shipping: Not available,2/17/2009,,grab microphon great senior year,Activision,0,E=Everyone,get readi live full high school music experi seri danc onto screen new way disney sing high school music 3 senior year excit video base karaok style game come complet microphon get chanc belt favorit song trio film like favorit charact move pipe keep perform love watch onscreen disney sing high school music 3 senior year featur full 25 song music video hsm franchis includ 10 song video high school music 3 senior year well select song previous two movi grab includ mic demonstr star power sing along addict hsm song gather friend multiplay fun includ duet versus team play mode let everyon get action even hone vocal skill littl help hsm star olesya rulin kelsi serv voic coach offer tip exercis design help improv sing,1,0,0,0,0,0,1,0,0,0,music danc parti,na
673,9194999,1.21805E+12,WWE Legends of WrestleMania,0,9.99,9.99,9,3.7,0,0,Shipping: Not available,3/24/2009,,take part greatest moment wwe histori,THQ,0,T=Teen,learn wwe legend wrestlemania xbox 360 flash demo synopsisrel excit memor moment wwe histori wwe legend wrestlemania game deliv doubl fist dose bodi slam intens classic 80s 90s wrestlemania action experi awesom fun play 40 wwe wrestler manag particip classic matchup allow unleash favorit move reenact stori rivalri brawn showmanship sheer nerv becom wwe legend time return root wwe experi real thrill classic wrestlemania match wwe legend wrestlemania recreat telecast 80s 90s painstak authent includ dynam visual treatment signatur ring entranc renown comment notabl venu unleash grappl move strike attack revers taunt favorit wwe hero excit new combo fight system particip key match varieti wrestlemania event wrestlemania tour mode fight way top put signatur spin excit color moment wwe histori see take reach wwe hall fame,1,0,0,0,0,0,0,0,0,1,na,blood languag use alcohol violenc
674,9215164,1.21806E+12,X Blades,0,19.99,19.99,6,3.5,0,0,Shipping: Not available,2/12/2009,,battl multitud danger monster classic hack slash style,SouthPeak,0,M=Mature,learn x blade flash demo synopsisgrab weapon get readi draw arsenal magic spell set bold violent quest make way across spectacular landscap encount hord danger monster determin thwart wield magic weapon skill chart cours toward one two possibl end compel fantasi adventur x blade play dare heroin ayumi make way across varieti indoor outdoor level seek hidden powerup execut challeng leap jump combin move locat locat reli power weapon includ innov blade gun har 20 differ type magic differ class confront array terrifi monster includ new creatur produc monster generat hone skill improv weapon varieti excit role play element strive make way path ultim lead success,1,0,0,0,0,0,0,1,0,0,action adventur,blood suggest theme violenc
675,9215333,1.21806E+12,Sonic's Ultimate Genesis Collection Platinum Hits,0,19.99,19.99,8,3.8,1,1,Shipping: Usually ships in 1-2 business days,2/12/2009,0,reliv adventur 40 classic titl,Sega,0,E10+=Everyone 10+,learn sonic ultim genesi collect xbox 360 flash demo synopsisreturn excit day sega genesi comprehens collect 40 classic titl experi frenet thrill sonic hedgehog underwat challeng ecco dolphin mani whether reliv fun childhood discov first time massiv compil find game suit everi mood everi player sonic ultim genesi collect evok fun classic sega genesi titl modern twist game old school 2d style upgrad 720p high definit ad new depth familiar gameplay make way various landscap use intuit control xbox 360 dive fun titl like street rage column phantasi star seri unlock arcad favorit sega vault includ congo bongo zaxxon prove skill hord enemi rang sonic nemesi dr eggman shuriken fling ninja even bring friend excit share fun select two player classic,0,0,0,0,1,1,0,0,0,0,retro classic,anim blood violenc
676,9215814,1.21806E+12,Disney Sing It: High School Musical 3: Senior Year,0,29.99,29.99,1,5,1,1,Shipping: Usually leaves our warehouse in 1 business day,2/17/2009,0,senior year never sound like much fun,Disney Interactive Studios,0,E=Everyone,get readi live full high school music experi seri danc onto screen new way disney sing high school music 3 senior year excit video base karaok style game get chanc belt favorit song trio film like favorit charact move pipe keep perform love watch onscreen disney sing high school music 3 senior year featur full 25 song music video hsm franchis includ 10 song video high school music 3 senior year well select song previous two movi demonstr star power sing along addict hsm song gather friend multiplay fun includ duet versus team play mode let everyon get action even hone vocal skill littl help hsm star olesya rulin kelsi serv voic coach offer tip exercis design help improv sing,0,0,0,1,0,0,1,0,0,0,music danc parti,na
684,9223501,1.21806E+12,Madden NFL 10,0,14.99,14.99,52,4.1,0,0,Shipping: Not available,8/14/2009,,fight everi yard experi raw power nfl,Electronic Arts,0,E=Everyone,learn madden nfl 10 flash demo synopsisfor two decad madden nfl seri deliv authent pro footbal experi steep aggress power strategi emot nfl madden nfl 10 legendari franchis deliv unpreced advanc kick realism game new level feel bone jar forc everi tackl frenet scrambl control fumbl puls kick adrenalin rush fight everi yard madden nfl 10 pack grit immediaci come expect groundbreak seri immers world nfl john madden take gridiron competit that intens precis authent ever madden nfl 10 new pro tak anim technolog let control outcom everi play deliv power drag defend toward first marker fight fumbl bottom pile use new quarterback avoid action evad rush becom ultim general manag control everi aspect nfl franchis enhanc franchis mode draft player sign free agent new tv broadcast style present new player equip madden nfl 10 kick new era footbal game authent,1,0,0,0,0,0,1,0,0,0,sport outdoor,na
685,9238336,1.21807E+12,Tom Clancy's Rainbow Six: Vegas / Ghost Recon Advanced Warfighter,0,29.99,29.99,1,4,0,0,Shipping: Not available,3/18/2009,,discov intens tom clanci two grip next gen game,Ubi Soft,0,M=Mature,experi intens world tom clanci two pack adrenalin fuel game tom clanci rainbow six vega tom clanci ghost recon advanc warfight thrust world global intrigu take street las vega rainbox six vega defus terrorist threat ensur continu global secur explor stun environ mexico citi ghost recon advanc warfight engag intric imagin urban warfar access militari technolog futur revolutionari next generat technolog bring las vega life let experi citi like never race time defend destruct tom clanci rainbow six vega real time tactic advic mission brief provid realist experi next generat artifici intellig match smart enemi work group counter move ad realism tom clanci ghost recon advanc warfight becom soldier futur use fulli integr combat system cut edg weapon communic system base actual militari research use cross com revolutionari communic devic power satellit technolog achiev complet battlefield awar experi immers chao urban warfar,1,0,0,0,0,0,0,1,0,0,na,blood intens violenc strong languag suggest theme
686,9248833,1.21807E+12,PopCap Arcade Vol. 2,0,2.99,2.99,1,4,0,0,Shipping: Not available,4/1/2009,,get three awesom arcad game one packag,PopCap,0,E10+=Everyone 10+,learn popcap arcad vol 2 xbox 360 flash demo synopsisrelish excit three action pack arcad style hit explod onto screen popcap arcad vol 2 pack three hit game one conveni packag magic masteri peggl munch mad feed frenzi 2 wick weaponri heavi weapon popcap arcad vol 2 offer thrill gameplay suit everi arcad game fan popcap arcad vol 2 let choos among three differ equal excit arcad style hit conquer 55 level 10 mystic magic power strive becom peggl master peggl chomp way victori feed frenzi 2 swim underwat world chow smaller fish heavi weapon deliv fast pace shoot em action blast away enemi tank plane 19 explos mission,1,0,0,0,0,1,0,0,0,0,na,na
687,9254111,1.21807E+12,Halo 3: ODST,0,19.99,19.99,144,3.8,1,1,Shipping: Usually leaves our warehouse in 1 business day,9/22/2009,0,prepar drop fierc orbit shock drop trooper,Microsoft,1,M=Mature,learn halo 3 odst xbox 360 flash demo synopsisth citi new mombasa lie ruin result catastroph attack coven orbit drop shock trooper odst must drop citi search clue known courag valor touch insan odst hell jumper neither larg supernatur gift spartan comrad make unwav nerv feroci attitud join legendarili fierc soldier dare mission prepar drop war torn world return grip world halo new perspect endur human coven struggl halo 3 odst embark vital top secret mission odst pride first unit deploy hostil situat delv even deeper ongo conflict grip stori cooper campaign new multiplay content immers game world stun new action fuel adventur,0,0,0,1,0,0,0,1,0,0,shooter,blood languag violenc
688,9254255,1.21807E+12,Hannah Montana: The Movie,0,7.99,7.99,,,1,1,Shipping: Usually ships in 1-2 business days,4/7/2009,0,experi life hannah montana get best world,Disney Interactive Studios,0,E=Everyone,learn hannah montana movi xbox 360 flash demo synopsismiley stewart seem like ordinari schoolgirl friend homework respons miley hide big secret unbeknownst peopl life also pop star hannah montana balanc two side life long challeng hannah montana popular begin rocket beyond expect miley pop star persona threaten take life dad take back hometown crowley corner tennesse take break limelight reconnect root dose realiti hannah montana need miley find pine rock star lifestyl hannah montana movi base walt disney pictur featur film let experi miley stewart secret doubl life live pop star dream hannah montana get know miley explor hometown embark excit adventur let unlock song stage cloth accessori see take balanc demand regular life excit secret star,0,0,0,0,1,0,1,0,0,0,action adventur,na
689,9257083,1.21807E+12,Stormrise,0,7.99,7.99,2,1,0,0,Shipping: Not available,4/1/2009,,tactic abil bring bloodi conflict final resolut,Sega,0,M=Mature,learn stormris xbox 360 flash demo synopsisfor mani year sai echelon race engag bloodi conflict domin turn enter battl see skill strategi take put end brutal war prepar explor stun 3d urban environ lead troop explos battl put tactic abil test delv straight heart action stormris deliv real time strategi thrill immers 3d environ battl take place amid sprawl citi tower skyscrap new 3rd person camera perspect combin unpreced vertic let explor vast underground area rooftop multilay vertic locat gain strateg advantag foe intuit next gen control give power lead troop front tactic playbook offer playbook style access combin excit strateg choic tradit rts game,1,0,0,0,0,0,0,1,0,0,strategi simul,na
690,9261014,1.21807E+12,Mafia II,0,19.99,19.99,16,4.3,1,1,Shipping: Usually ships in 1-2 business days,8/24/2010,0,seek piec american dream member mob,2K Games,0,M=Mature,golden age 1950s american dream seem closer other vito son poor italian immigr long throw shackl poverti held entir life alreadi well practic petti crime begin aspir higher crimin art organ crime lure wealth power come mob tie vito childhood friend joe find spiral ever deeper hold mafia struggl make name street unforgiv citi die tri mafia ii thrust world bullet riddl violenc intrigu follow intens mafia dark unforgiv world mob come aliv gangster movi style narrat power claw way top crimin underworld engag stun car car gunfight white knuckl hand hand combat intens gunplay script write team origin mafia soundtrack rich music evok game 1950s set mafia ii immers fulli mob experi brutal inescap,0,0,0,0,1,0,0,1,0,0,action adventur,blood intens violenc nuditi sexual content strong languag use drug alcohol
691,9261746,1.21807E+12,Wolfenstein,0,29.99,29.99,11,3.9,1,0,Shipping: Not available,8/18/2009,,go behind enemi line stop nazi sinist new weapon,Activision,0,M=Mature,learn wolfenstein flash demo synopsiswar rage axi alli power mere convent weapon come play nazi obsess occult well known evid emerg point nazi possess new mysteri supernatur power sent special mission heart reich investig terribl weapon discov may drastic consequ chang cours histori forev wolfenstein nazi process creat weapon war end mass destruct har power black sun dark parallel dimens call veil take role bj blazkowicz decor member offic secret action must face strang feroci enemi lurk landscap team resist fighter unleash power divers rang weaponri includ occult enhanc weapon abl put stop nazi sinist plot world fall prey dark pervers ambit,1,0,0,0,0,0,0,1,0,0,shooter,blood gore intens violenc languag blood gore intens violenc languag
692,9262237,1.21807E+12,Brtal Legend,0,19.99,19.99,9,4.7,0,0,Shipping: Not available,10/13/2009,,jack black battl evil age rock,Electronic Arts,0,M=Mature,learn brtal legend flash demo synopsiseddi rigg ordinari roadi littl dream excit extrem fate lie store get suck mythic age rock find cast unlik hero univers rock rule join head bang journey he'll fight evil find love discov life purpos mention command awesom power rock jack black star eddi roadi heavi metal open world brtal legend roam world chrome leather rocker babe epic music mountain made guitar amp fire breath stud wear beast arm axe guitar group minion set liber armi headbang life oppress unleash power rock dare oppos use demon slay electr creat guitar summon object buff teammat crippl oppon rock soundtrack tear everi era metal music classic 70s metal 80s hair metal scarier metal cousin 90s,1,0,0,0,0,0,0,1,0,0,action adventur,blood gore intens violenc partial nuditi strong languag suggest theme
693,9265038,1.21807E+12,Transformers: Revenge of the Fallen,1,19.99,19.99,9,3.8,1,0,Shipping: Not available,6/23/2009,0,becom autobot decepticon,Activision,0,T=Teen,learn transform reveng fallen flash demo synopsisbrac awesom robot thrill transform reveng fallen explod across screen inspir featur film reveng fallen catapult transform univers adrenalin pump battl supremaci war span globe intens action rich graphic bring excit movi life embark immers adventur fate world may determin choic make transform reveng fallen experi transform world either autobot decepticon play favorit transform unleash uniqu abil upgrad weapon take danger enemi war rage across earth experi high octan excit drive fli fight shoot way varieti challeng level switch instant robot vehicl weapon mode new system give precis control incred power transform,1,0,0,0,0,0,0,0,0,1,na,na
694,9265387,1.21807E+12,Singularity,0,29.99,29.99,8,4.4,0,0,Shipping: Not available,6/29/2010,,manipul time unravel conspiraci,Activision,0,M=Mature,remot island katorga 12 dark secret lurk prepar travel haunt unsettl environ unburden constraint ordinari time shift forc buffet back forth present past back strength wit nerv take har forc time unravel dead conspiraci singular thrust ever shift world time understand appli brace hurtl past sudden time wave jolt back time year 1950 send rocket back present roam environ popul eeri time ravag creatur wield power time manipul devic turn tide time favor help solv conspiraci lie heart katorga 12,1,0,0,0,0,0,0,1,0,0,action adventur,blood gore intens violenc strong languag
695,9276473,1.21807E+12,Call of Duty: Modern Warfare 2,0,29.99,29.99,427,4.6,1,1,Shipping: Usually leaves our warehouse in 1 business day,11/10/2009,0,take fight next level,Activision,1,M=Mature,learn call duti modern warfar 2 flash demo synopsisfight surviv shoot way mission success acclaim call duti franchis make triumphant return explod realism intens becom hallmark grip seri lay wast enemi hail gunfir erupt move intens action make sure prepar answer call duti harrow sequel call duti 4 modern warfar thrust haze battl arm sophist tool destruct get readi stare death face enter rage conflict experi rigor battl struggl long odd seiz victori awesom power war come aliv grit glori call duti modern warfar 2,0,0,0,1,0,0,0,1,0,0,shooter,blood drug refer intens violenc languag
696,9285686,1.21807E+12,Fight Night: Round 4,0,19.99,19.99,44,4.5,0,0,Shipping: Not available,6/24/2009,,set fight age,Electronic Arts,0,T=Teen,learn fight night round 4 flash demo synopsisth ring place weak crowd around sens strength show rule brutal sport fist readi fli arm coil energi readi unleash oppon deserv face knock loop power tyson style hook uppercut make like ali swift feet faster fist fight night seri return anoth knockout perform fight night round 4 feel hard hit world box come life around revolutionari new physic base fight system physic driven anim employ devast arsenal punch block ring movement even engag rough tumbl insid fight impress roster boxer includ everyon muhammad ali iron mike tyson let experi incred realist boxer style set fantasi matchup favorit boxer across era determin realli own ring,1,0,0,0,0,0,0,0,0,1,sport outdoor,mild blood mild lyric mild suggest theme violenc
697,9291232,1.21808E+12,Tekken 6,0,19.99,19.99,8,3.8,1,1,Shipping: Usually ships in 1-2 business days,10/27/2009,0,take king fight,Namco Bandai Games,0,T=Teen,learn tekken 6 flash demo synopsisrais fist get readi fight brutal finish battl come aliv bone jar realism pummel oppon utmost inflict maximum damag fist fast grip strong enough help domin ultim king iron fist tournament stori fight franchis return anoth bout tekken 6 select impress roster fighter signatur set dead techniqu unleash power lightn fast move combo overcom oppon custom charact achiev uniqu advantag battl mano mano king iron fist tournament come life around stun high definit,0,0,0,0,1,0,0,0,0,1,fight,alcohol refer crude humor mild languag suggest theme violenc
698,9302168,1.21808E+12,Up,0,19.99,19.99,2,2.5,1,0,Shipping: Not available,5/26/2009,,experi high fli fun disney pixar anim film,THQ,0,E10+=Everyone 10+,learn flash demo synopsisset adventur high fli fun featur film come aliv carl fredricksen young sidekick wilder explor russel set uniqu journey come along ride join duo travers undiscov jungl south america put skill test navig treacher terrain battl danger creatur even compet soar aerial combat let experi fun four movi main charact includ carl russel dug lovabl dog kevin prehistor bird best overcom obstacl rock format rage river face creatur rang danger dog exot anaconda make way use environ around includ move boulder swing vine jump teeter totter collect varieti item help unlock cheat bonus content bonus movi take fun even greater height,1,0,0,0,0,1,0,0,0,0,action adventur,anim blood mild cartoon violenc
