index,sku,productId,name,new,regularPrice,salePrice,customerReviewCount,customerReviewAverage,freeShipping,onlineAvailability,onlineAvailabilityText,releaseDate,shippingCost,shortDescription,manufacturer,inStorePickup,esrbRating,longDescription,onlineAvailability_notAvailable,onlineAvailability_preOrder,onlineAvailability_soldOut,onlineAvailability_businessDay1,onlineAvailability_businessDay12,esrb_everyone10,esrb_everyone,esrb_mature,esrb_pending,esrb_teen,genre,esrb_description
420,3152127,1.21838E+12,PES 2012: Pro Evolution Soccer,0,29.99,29.99,,,0,0,Shipping: Not available,9/27/2011,,life love pursuit goal,Konami,0,E=Everyone,hear rowdi fan roar excit expert speed precis dribbl ball charg field teammat posit take pass manag evad oppon teammat know experi can't make goal oppon quick charg take ball back pass back one swift kick send team hope aloft ball appear move slow motion hurtl toward goal goalkeep dive aim true seal victori team pes 2012 pro evolut soccer improv power authent renown seri enhanc intensifi incred excit soccer immers action stun realist visual bring stadium atmospher right live room experi innov ai control ensur teammat work togeth close space defend zonal hold defens line minim attack control two player teammat control system prompt run draw defend one player hold ball enjoy improv shoot movement reaction well enhanc anim truli make soccer experi come aliv,1,0,0,0,0,0,1,0,0,0,sport outdoor,na
421,3166581,1.21838E+12,Metal Gear Solid HD Collection,0,39.99,39.99,5,5,1,1,Shipping: Usually leaves our warehouse in 1 business day,11/8/2011,0,immers tactic espionag action new hd display,Konami,1,M=Mature,wake cuban missil crisi costa rica somehow maintain peac neutral latin america becam essenti maintain power balanc east west region neutral countri mysteri arm forc engag suspici activ metal gear solid peac walker soldier without border move action preserv peac metal gear solid 2 son liberti join foxhound agent raiden first real mission infiltr big shell deal arm group known son liberti action continu metal gear solid 3 snake eater snake given order assassin boss head back soviet union cold war metal gear solid hd collect let engag tactic espionag action like never play favorit metal gear solid game pick everi detail frame rate boost 60 fps graphic enhanc 720p enjoy smooth precis control thank right analog stick format forc feedback complet mission experi new style play metal gear solid peac walker trophi achiev mode thought metal gear solid get better,0,0,0,1,0,0,0,1,0,0,action adventur,na
422,3166824,1.21838E+12,Never Dead,0,19.99,19.99,2,2.5,1,1,Shipping: Usually leaves our warehouse in 1 business day,1/31/2012,0,reason fear death,Konami,1,M=Mature,500 year ago man wife stood vicious demon king challeng immort evil lost fight lost love life render immort bryce boltzmann work nation anti demon agenc nada oper guis offic assist secretari health ash arcadia young univers graduat hire work ash think bryce arcadia must work togeth extinguish demon forc modern day world late step shoe bryce boltzmann never dead seek redempt demon forc took wife immers tragic storylin gameplay work quell demon forc grow stronger experi uniqu third person gameplay featur excit decapit regener mechan allow detach arm throw enemi explod deton devic make use immort decim enemi critic situat electrocut fire electr bullet catch fire becom light sourc purchas never dead best buy receiv access two exclus powerup seduct quick reload aid team battl take villain take world around destruct environ let destroy entir build use pillar floor wall domin enemi elimin dark forc respons immort,0,0,0,1,0,0,0,1,0,0,action adventur,blood gore intens violenc languag
423,3167059,1.21838E+12,Birds of Steel,0,39.99,39.99,,,1,1,Shipping: Usually leaves our warehouse in 1 business day,3/13/2012,0,pilot 100 real life plane intens aerial battl wwii,Konami,0,T=Teen,damag taken caus bird jerk heavili right fuel run low hope got enough ammo left take one enemi last fighter come around anoth pass grip control brace anoth round gruel dogfight burst light erupt enemi shoot he get jumpi fire mani precious round earli experienc aviat like make mistak wait right moment squeez trigger patienc pay pepper enemi fighter gunfir plane drift helpless earth leav thick black trail smoke wipe sweat brow head home ace brace suspens aerial combat histor accur creation bird steel fli back time pilot 100 real life plane intens aerial battl world war ii put life line skill test experi gut wrench dogfight thrill dive bomb strap cockpit icon war machin take 20 histor mission hundr procedur mission scatter across 16 real life locat see view sky learn landscap pearl harbor guadalcan wake island use realist map actual satellit photo enjoy authent control manipul aileron rudder affect plane speed plane featur 100 hit point monitor fighter health damag aerial warfar ensu go onlin compet 16 aviat around globe time earn wing,0,0,0,1,0,0,0,0,0,1,flight,mild languag mild suggest theme violenc
424,3180602,1.21838E+12,Bodycount,0,19.99,19.99,,,1,1,Shipping: Usually leaves our warehouse in 1 business day,8/30/2011,0,target go kill,Codemasters,1,M=Mature,know much truth rest world know even less cover convent war zone africa asia there clandestin global power struggl rage enemi known target group call network work network wield power arsenal contemporari firearm blow environ enemi take target rack bodycount achiev chain kill earn powerup tear complet destruct environ bodycount elimin enemi gather intel bodi creat combat chain skill kill earn unlock special abil devast air strike power ammo upgrad adrenalin shot team friend take enemi co op competit multiplay experi fight surviv death match team death match mode map evolv cours game shred cover creat peek hole blast escap rout co op mode work player defend increas difficult wave target oper use cun creativ surviv,0,0,0,1,0,0,0,1,0,0,shooter,blood violenc
425,3184753,1.21838E+12,Spec Ops: The Line Premium Edition,0,59.99,59.99,2,3.5,1,1,Shipping: Usually leaves our warehouse in 1 business day,6/26/2012,0,readi walk line moral immor,2K Games,1,M=Mature,six month sinc dubai wipe map cataclysm sandstorm thousand live lost includ american soldier sent evacu citi today citi lie buri sand world opul ruin mysteri radio signal pick dubai delta recon team sent infiltr citi mission simpl locat survivor radio evac find citi grip war save dubai they'll find man heart mad col john konrad,0,0,0,1,0,0,0,1,0,0,shooter,blood gore intens violenc strong languag
426,3184908,1.21838E+12,UFC Undisputed 3,0,59.99,59.99,4,5,1,1,Shipping: Usually leaves our warehouse in 1 business day,2/14/2012,0,experi octagon like never,THQ,1,T=Teen,crowd rowdi arena smell like blood sweat easi squar hulk beast aim smash face grind bone love train workout regimen previous fight boil one championship fight announc rambl crowd chant name stand end walkway take hood make way toward octagon critic acclaim mma videogam franchis return ufc undisput 3 featur intens toe toe combat stun visual present increas access execut soccer style kick head stomp ground knee oppon head legendari pride mode featur offici announc renown japanes mma leagu rule make oppon beg merci land new bone crush move take advantag down oppon use brand new submiss system excit new camera posit intimid fighter entranc improv facial anim gritti high contrast appear put close person favorit ufc star tradit simplifi control option player skill level perform standard strike complex ground transit mechan put skill test see got take defeat 150 prolif ufc fighter includ athlet new featherweight bantamweight divis step octagon break oppon spirit bruis ego,0,0,0,1,0,0,0,0,0,1,sport outdoor,blood languag suggest theme violenc
427,3209295,1.21839E+12,El Shaddai: Ascension of the Metatron,0,19.99,19.99,,,1,1,Shipping: Usually leaves our warehouse in 1 business day,8/16/2011,0,captur fallen angel prevent flood fate mankind depend,Ignition Entertainment,1,T=Teen,long ago mankind take first breath god put forth plan human race keep protect appoint human angel grigori watch heaven known watcher grigori obey god wish kept watch eye human year pass vigil angel becam captiv live human led full freedom passion privileg fascin soon grew obsess feel long desir lust one fate day grigori turn away god descend earth heaven highest order council elder becam infuri learn betray council rage enflam discov fallen angel taken daughter men deviat mankind god plan set matter right council decid send horrif flood annihil entir human race one man object decis enoch righteous scribe whose passion persuad god bring heaven still mortal council heard enoch plea agre spare mankind one condit enoch must captur fallen angel bring back heaven imprison upon return earth enoch meet azazel one seven fallen angel azazel refus return heaven instead goe hide angel warn enoch follow enoch heed fallen angel advic journey begin el shaddai ascens metatron thrust role enoch return earth prevent impend flood play game pace enjoy deep thrill action easi use three button control system experi uniqu gameplay blend varieti style includ 2d side scroll action 3d explor wield power weapon hand heaven battl oppon make way stun landscap use arch holi blade power slice anyth path trek captur fallen grigori enjoy cinemat cut scene full orchestr music score sure pull enhanc game experi keep eye matter voyag zero hud player feedback system use dynam environ charact audio clue engag without clutter screen mani distract hunt track fallen angel bring back meet maker,0,0,0,1,0,0,0,0,0,1,action adventur,anim blood fantasi violenc mild suggest theme
428,3230198,1.21839E+12,uDraw GameTablet with uDraw Studio: Instant Artist,0,49.99,49.99,4,4.3,1,1,Shipping: Usually leaves our warehouse in 1 business day,11/15/2011,0,let imagin artist side run wild,THQ,1,E=Everyone,love beauti soft line classic art found museum also inspir freedom emot intens work found street find care balanc two alway struggl let artist side run free virtual draw capabl udraw studio instant artist power udraw gametablet xbox 360 sit back pick stylus start creat work art today unleash creativ showcas inner artist udraw gametablet udraw studio instant artist draw game power capabl xbox 360 draw paint play share creation full high definit fine tune art make gorgeous smatter ink touch screen control udraw gametablet allow pinch stretch zoom free form finger paint take hold pressur sensit stylus featur 256 point pressur sensit give realist feel pencil paintbrush piec charcoal screen bring creation life creat comfort favorit seat thank wireless connect easili control action screen integr xbox 360 control use built tilt motion featur shake jump tilt way fun fill game,0,0,0,1,0,0,1,0,0,0,kid famili,anim blood comic mischief
438,3244621,1.21839E+12,The Elder Scrolls V: Skyrim Collector's Edition,0,59.99,59.99,6,5,1,0,Shipping: Not available,11/11/2011,0,belov seri back bonus materi,Bethesda Softworks,1,M=Mature,long await much anticip next instal award win elder scroll franchis expans open world forev revolution face fantasi epic lead deeper combat magic myth ever time play charact truli becom whomev wish freedom anyth possibl imagin follow 2006 game year elder scroll iv oblivion offer stun graphic grip storylin immers game moment turn readi unrol scroll let journey begin imagin roll cloud rug mountain bustl citi lush field crumbl dungeon imagin ancient dragon behold secret power could transform futur elder scroll v skyrim immers engross world franchis alreadi know love realism choic intens ever featur new game engin bring everi tini environment aspect life blister detail ai bring close alli enemi skyrim blur line world game new charact engin open wider alreadi vast virtual world put everi decis everi action everi consequ entir hand arm hundr new weapon abil spell immacul fifth chapter challeng skill immers mind forev chang way view game collector edit featur 12 statu world eater alduin perch atop dragon wall display fandom perus 200 page full color illustr sketch model depth art skyrim offici art book detail coffe tabl book includ foreword game director todd howard commentari bethesda game studio artist detail charact creatur environ weaponri game know stori insid take break action get insid look stori gameplay set legaci elder scroll franchis make elder scroll v skyrim documentari dvd time return time skyrim,1,0,0,0,0,0,0,1,0,0,role play,blood gore intens violenc sexual theme use alcohol
439,3301256,1.21839E+12,The Penguins of Madagascar: Dr. Blowhole Returns Again,0,49.99,49.99,,,1,1,Shipping: Usually leaves our warehouse in 1 business day,9/13/2011,0,stop danger devious dolphin world domin,THQ,1,E=Everyone,devious dolphin dr blowhol return conquer world back legion lobster minion dr blowhol new plan dolphin world domin he use penguin achiev goal whether know embark excit raucous new adventur team penguin take outsid zoo ultim dr blowhol lair stop mad sea fare mammal late stop danger dr blowhol take world favorit penguin penguin madagascar dr blowhol return dr blowhol unleash plan world domin team penguin stop lobster minion late explor complex level solv challeng puzzl find help item build crazi machin race clock rescu penguin friend overcom obstacl travers hazard penguin possess uniqu abil come handi differ situat rico regurgit explos kowalski build devic privat fit tight space play fun fill mini game includ ninja knock mort bowl wacki danc king julien prevent dr blowhol take world,0,0,0,1,0,0,1,0,0,0,action adventur,comic mischief mild cartoon violenc
440,3301556,1.21839E+12,F1 2011,0,49.99,49.99,4,4,1,1,Shipping: Usually leaves our warehouse in 1 business day,9/20/2011,0,feel rush fastest race track world,THQ,1,E=Everyone,glamour exhilar intens speed driver cruis smooth 200 mph minimum cutthroat team carv dynasti speed formula one elit race circl world thrill motorsport tear track everi curv track everi control dashboard everi strategi pit lane utmost import intensifi world creat stun detail f1 2011 immers driver seat driver complet experi full throttl world fia formula one race progress race game deliv authent thrill exclus licens formula one bring star car thrill world take celebr persist challeng real formula one racer rip 19 circuit driven ego game technolog f1 2011 give unequ handl cut edg graphic advanc physic right ingredi handl formula one,0,0,0,1,0,0,1,0,0,0,race,mild lyric
441,3302121,1.21839E+12,The Black Eyed Peas Experience,0,19.99,19.99,12,3.9,1,1,Shipping: Usually leaves our warehouse in 1 business day,11/8/2011,0,danc parti come live room,Ubisoft Entertainment,1,T=Teen,get parti start live room world hottest group world hottest new danc game black eye pea experi featur 30 chart top track black eye pea includ biggest hit transform global phenomenon perform icon danc move alongsid apl de ap fergi taboo profession choreographi design exclus group take parti worldwid jump tour experi energi unforgett venu inspir show music video black eye pea experi ultim danc game ultim way keep parti rock,0,0,0,1,0,0,0,0,0,1,music danc parti,strong lyric suggest theme
446,3425352,1.2184E+12,Deepak Chopra's Leela,0,29.99,29.99,,,1,1,Shipping: Usually leaves our warehouse in 1 business day,11/8/2011,0,achiev sens focus rejuven develop flow state help kinect,THQ,1,E=Everyone,rush hour traffic hectic work schedul fill social calendar get kid readi school find time center tough deepak chopra leela provid uniqu interact experi help achiev peac focus flow state relax mediat techniqu ancient theori chakra creat collabor world renown expert mind bodi heal deepak chopra leela aim help develop healthier harmoni balanc life har power kinect immers relax medit deepak chopra leela sanskrit pastim sport play leela combin physic activ deep medit immers experi xbox 360 develop flow state focus attent specif part bodi relax seven movement rejuven inner peac still medit allow kinect measur breath provid gentl feedback encourag creat person mandala share facebook achiev inner peac immers experi fill brilliant landscap captiv audio,0,0,0,1,0,0,1,0,0,0,strategi simul,na
447,3431061,1.2184E+12,Prototype 2,0,59.99,59.99,3,4.7,1,1,Shipping: Usually leaves our warehouse in 1 business day,4/24/2012,0,unleash power quest kill alex mercer,Activision,1,M=Mature,new york zero post viral wasteland broken three distinct district green zone heavili militar yellow zone overcrowd refuge camp noth quarantin shanti town war ravag nightmar known red zone blacklight virus complet overrun great citi skyscrap popul sgt jame heller soldier left die distraught husband deceas wife father dead son infect one thing left hunt kill alex mercer becom ultim shape shift weapon prototyp 2 cut wasteland post viral new york zero build genet arsenal new biolog weapon abil quest murder maker devil alex mercer wit build size infect beast ambush entir citi street glide parkour across cityscap take swarm high train blackwatch soldier step role sgt jame heller hunt kill becom anybodi stand way absorb memori gain new abil wield unbeliev tendril power allow lift tear apart car militari vehicl ensnar power infect beast shred group enemi piec track enemi emit sonar puls bodi choos wide varieti new mutat perk includ better locomot abil sharper claw enhanc disguis abil build custom ultim prototyp virus left citi ruin go stop achiev goal unleash true power infect rage within kill alex mercer,0,0,0,1,0,0,0,1,0,0,action adventur,blood gore drug refer intens violenc sexual theme strong languag
448,3432088,1.2184E+12,The Lord of the Rings: War in the North Collector's Edition,0,39.99,39.99,,,1,1,Shipping: Usually leaves our warehouse in 1 business day,11/1/2011,0,creat fellowship defeat sauron forc,WB Games,1,M=Mature,sauron forc grow stronger north journey middl earth long peril ventur unfamiliar land head gruesom battl danger enemi fight turn tide war grate fellowship human elf teammat everi step way enhanc team individu skill special abil cours dead weapon fellowship strong enough defeat sauron forc bring end war north team two friend lord ring war north epic role play adventur challeng work togeth fellowship defeat threat middl earth choos play dwarf elf human embark journey creat especi collabor three player gameplay upgrad weapon skill special abil advanc game custom charact establish loot reward system explor new familiar land stori charact movi book engag realist combat dark danger world creat j r r tolkien bring world life collector edit show lord ring pride authent ranger north quiver case studi game get depth look concept art key charact various enemi stun environ middl earth flip detail page war north compil lord ring artwork take break game action go behind scene insid look music war north see interview footag legendari compos inon zur abbey road studio e3 2011 concert event plus three track game soundtrack fate middl earth lie reli fight side,0,0,0,1,0,0,0,1,0,0,role play,blood gore intens violenc
449,3433032,1.2184E+12,Borderlands 2,0,59.99,59.99,1,5,1,1,Shipping: Pre-order,9/18/2012,0,gunzerk he load serious weaponri,2K Games,1,M=Mature,borderland 2 further distinct blend first person shooter role play genr creat true evolut role play shooter team three player four player onlin good go old school two player split screen couch share mayhem spend hour level charact equip one million weapon borderland 2 featur new visual stun array procedur generat gun shield grenad artifact enemi choos one four new charact class taken care craft connect stori new surpris environ across live planet pandora make new friend arm teeth fight alongsid relentless quest reveng redempt,0,1,0,0,0,0,0,1,0,0,shooter,blood gore intens violenc languag sexual theme use alcohol
450,3447104,1.2184E+12,The Elder Scrolls IV: Oblivion Game of the Year Edition,0,19.99,19.99,,,1,1,Shipping: Usually ships in 1-2 business days,9/27/2011,0,continu legend game year edit,Bethesda Softworks,1,M=Mature,empir tamriel verg total collaps emperor dead desper faction mad scent power compet control throne make matter wors gate oblivion open vicious demon lay wast land tide dark must turn solidar empir must restor prepar save tamriel continu elder scroll saga elder scroll iv oblivion game year edit includ knight nine shiver isl expans pack unravel new quest explor new area expans adventur knight nine help long disband group hero reclaim former glori travel territori cyrodil shiver isl explor new realm sheogorath battl world divid dementia mania amongst hideous denizen island prepar experi cut edg artifici intellig stun visual intens storylin made elder scroll seri legend,0,0,0,0,1,0,0,1,0,0,role play,blood gore languag sexual theme use alcohol violenc
451,3447113,1.2184E+12,Prey 2,0,59.99,59.99,,,1,1,Shipping: Pre-order,8/14/2012,0,reload brand new adventur award win prey univers,Bethesda Softworks,1,RP=Rating Pending,feder marshal killian samuel anyth anoth day offic abduct cruel race alien maroon alien planet known exodus take work bounti hunter come across danger plot threaten home world arm dead weapon skill put stop peril plan strap armor load weapon action prey 2 sequel award win prey assum role feder marshal killian samuel tri make sens thing abduct menac gang brutal alien set put end plot place home planet danger explor open world exodus sci fi first person shooter adjust dynam gameplay mission chang reaction choic featur fast pace action immers storylin prey 2 give thrill hunt danger futurist alien world arsenal innov weapon high tech alien gadget special skill dispos fight enemi pursu prey use action chain mechan reward danger imagin maneuv experi new level first person combat agil combat system allow slide cover blind fire leap barrier brace fast pace action readi fight back,0,1,0,0,0,0,0,0,1,0,shooter,na
452,3447362,1.2184E+12,Grease: Dance,0,29.99,29.99,1,5,1,0,Shipping: Not available,10/25/2011,,prove got littl greas lightn,505 Games,0,T=Teen,danc rydel high drama fill girl night seat clench car race win girl heart leather jacket poodl skirt oh summer night romanc rock n roll 50s style teenag angst greas alway heart they'r hand jive way right live room greas danc slick back hair rev engin lace danc shoe swing back nifti 50s reliv music classic way meant experienc whole bodi feel heart pound excit prom night pair bird pink ladi perform authent duet choreographi that true movi 1950s style kinect sensor everi move make show screen even record use kinect camera partner alway magic memori danc floor vocal chord blow olivia newton john john travolta water belt 20 song includ favorit movi rock n roll classic 50s karaok mode host girl night hang guy whole gang compet huge sing off danc off eight peopl take wear pink inner streak greas lightn show greas danc,1,0,0,0,0,0,0,0,0,1,music danc parti,na
453,3447468,1.2184E+12,Blackwater,0,13.99,13.99,1,4,1,1,Shipping: Usually leaves our warehouse in 1 business day,10/25/2011,0,use power movement annihil dead enemi,505 Games,1,T=Teen,congratul soldier select join elit forc tactic expert born assassin known blackwat oper arm incred dead weapon train surviv brutal battl environ world convoy singl mission kill kill shadowi world undercov oper must prove militari might strateg mind annihil enemi failur option everi move make utmost import join rank blackwat oper one accident pull trigger could blast cohort piec one misplac hand movement could crash vehicl fieri explos grip xbox 360 first person shooter first featur total gestur driven control via kinect sensor fate enemi unit liter within hand embark varieti high stake mission erupt site planet command firepow vehicl use 25 differ move immers entir bodi action militari reach unpreced level might launch blackwat campaign kinect broken barrier battl immers bodi handl challeng blackwat,0,0,0,1,0,0,0,0,0,1,shooter,mild languag violenc
454,3447762,1.2184E+12,Anarchy Reigns,0,59.99,59.99,,,1,0,Shipping: Not available,12/31/2012,0,post apocalypt world give surviv fittest whole new mean,Sega,0,M=Mature,post apocalypt futur massiv open fantast world cyborg human live amongst one anoth power struggl intens goal ultim survivor take come top surviv fittest take role imagin human cyborg charact top close combat anarchi reign master eight charact uniqu style weapon signatur kill move becom ultim survivor take cover action trigger event provid constant chang gameplay environ real time event black hole plane crash blitz bomb challeng friend multiplay mode includ battl royal deathmatch surviv mode play jack leo singl player campaign mode ultim surviv fittest immers violenc combat post apocalypt futur anarchi reign,1,0,0,0,0,0,0,1,0,0,fight,blood gore intens violenc partial nuditi sexual theme strong languag
455,3455185,1.2184E+12,Cabela's Big Game Hunter 2012,0,29.99,29.99,,,1,0,Shipping: Not available,9/27/2011,0,embark thrill adventur search world greatest trophi anim,Activision,0,T=Teen,mist cold mountain cloud effect visibl got bead elk pass 100 yard track beast hour stay downwind catch scent kept low ground behind rock stay sight trust hunter instinct know he'd go next follow kind terrain determin pay pick head got sight put bolt grab gear take thrill excurs around world search world greatest trophi anim cabela big game hunter 2012 travers multitud open access environ hunt way high elev clear shot cover lower ground good conceal poor visibl use skill outsmart prey care clever realist anim see hear smell put hunt abil ultim test nab trophi watch anim uniqu movement learn habit purchas upgrad visibl weak strength select varieti firearm gear get best advantag prey take fun new galleri mode includ reflex target shoot four friend steadi hand quick trigger take world biggest game,1,0,0,0,0,0,0,0,0,1,sport outdoor,blood violenc
