index,sku,productId,name,new,regularPrice,salePrice,customerReviewCount,customerReviewAverage,freeShipping,onlineAvailability,onlineAvailabilityText,releaseDate,shippingCost,shortDescription,manufacturer,inStorePickup,esrbRating,longDescription,onlineAvailability_notAvailable,onlineAvailability_preOrder,onlineAvailability_soldOut,onlineAvailability_businessDay1,onlineAvailability_businessDay12,esrb_everyone10,esrb_everyone,esrb_mature,esrb_pending,esrb_teen,genre,esrb_description
191,2087044,1.21831E+12,Brunswick Pro Bowling,0,29.99,29.99,3,2,1,0,Shipping: Not available,2/22/2011,0,serious pin push,Crave,0,E=Everyone,pressur mount ball heavi rest hand finger entrench three hole take deep breath angl arm right make approach let fli lane flawless backspin perfect aim sound ball roll along wood clatter pin hum machin bowl art form artist everi moment count everi move precis can't settl bowl game that less perfect bring sheer artistri pin smash exhilar alley live room bowl experi unlik stream screen lace bowl shoe strap wrist guard strike chase challeng brunswick pro bowl shatter pin format vivid glori advanc physic system gather buddi friend game fierc competit later test lane domin skill varieti singl player challeng onscreen onlin rule alley pro style equip person bowler brunswick gear may america offici pastim belov competit precis aim power three strike world,1,0,0,0,0,0,1,0,0,0,sport outdoor,na
192,2095189,1.21831E+12,The Elder Scrolls V: Skyrim,0,59.99,59.99,88,4.9,1,1,Shipping: Usually leaves our warehouse in 1 business day,11/11/2011,0,belov seri back,Bethesda Softworks,1,M=Mature,long await much anticip next instal award win elder scroll franchis expans open world forev revolution face fantasi epic lead deeper combat magic myth ever time play charact truli becom whomev wish freedom anyth possibl imagin follow 2006 game year elder scroll iv oblivion offer stun graphic grip storylin immers game moment turn readi unrol scroll let journey begin imagin roll cloud rug mountain bustl citi lush field crumbl dungeon imagin ancient dragon behold secret power could transform futur elder scroll v skyrim immers engross world franchis alreadi know love realism choic intens ever featur new game engin bring everi tini environment aspect life blister detail ai bring close alli enemi skyrim blur line world game new charact engin open wider alreadi vast virtual world put everi decis everi action everi consequ entir hand arm hundr new weapon abil spell develop bethesda game studio creator 2008 game year fallout 3 immacul fifth chapter challeng skill immers mind forev chang way view game time return time skyrim,0,0,0,1,0,0,0,1,0,0,role play,blood gore intens violenc sexual theme use alcohol
198,2106238,1.21831E+12,Dreamcast Collection,0,19.99,19.99,2,3.5,1,1,Shipping: Usually ships in 1-2 business days,2/23/2011,0,play favorit dreamcast titl xbox 360,Sega,0,T=Teen,rememb dreamcast held secret hour entertain crazi adventur world gameplay xbox 360 rule game room can't help miss old dreamcast game could combin favorit dreamcast titl power stun graphic xbox 360 thank dreamcast collect xbox 360 enjoy four favorit dreamcast game includ sonic adventur crazi taxi space channel 5 part 2 sega bass fish power xbox 360 consol enjoy great game featur high definit graphic widescreen support compar score other leaderboard collect whether want speed unchart territori sonic adventur make quick cash crazi taxi defend planet menac invad space channel 5 part 2 relax open water sega bass fish dust dreamcast,0,0,0,0,1,0,0,0,0,1,retro classic,mild violenc languag mild fantasi violenc suggest theme
199,2107458,1.21831E+12,Battlefield 3 Limited Edition,0,24.99,24.99,88,4.3,1,0,Shipping: Not available,10/25/2011,,take war new height,Electronic Arts,0,M=Mature,street quiet quiet train eye one two point entri sure way enemi come assault soon brought weapon readi hear whizz nois bullet fli past inch ear sudden build right burst explos send fli air smash opposit build resound thud lie helpless watch bit crumbl wall roll toward get keep fight fallen comrad lay besid know must drag safeti he go surviv live depend welcom battlefield join elit u marin battl enemi across claustrophob street metropolitan downtown vehicl friend landscap unit state europ middl east whether master art urban combat pilot land sea air vehicl battlefield 3 immers incred realist gameplay power new frostbit 2 game engin battlefield becom aliv interact ever heart pound singl player mission massiv 24 player onlin battl battlefield 3 immers fight cut edg anim destruct light scale audio favorit experi battlefield 2 also come aliv intens ever limit edit incred battlefield 3 back karkand pack featur four legendari map battlefield 2 imagin frostbit 2 technolog plus classic battlefield 2 weapon vehicl reward achiev trophi comprehens pack put back battl got today prepar war attack countri attack sens incred physic lifelik way prepar battlefield 3,1,0,0,0,0,0,0,1,0,0,shooter,na
200,2138219,1.21831E+12,Dynasty Warriors 7,0,39.99,39.99,,,0,0,Shipping: Not available,3/29/2011,,grab weapon prepar battl,Tecmo,0,T=Teen,feel weight sword left hand delic balanc spear right fierc daunt warrior charg prepar fight parri attack dodg thrust push back heavi strike around clank metal reverber air combin sound splinter wood remind attack come yet anoth strike throw switch attack pierc armor spear stun gape end wooden stick tenth year dynasti warrior franchis return dynasti warrior 7 game transit seamless gameplay cutscen immers experi addit wei wu shu jin faction greater varieti warrior choos larger stori ever combin differ weapon new dual weapon battl system battl enemi switch weapon mid combo counterattack guard creat stun end string strike dead switch attack clear occupi citi conquest mode offic walk freeli town creat weapon trade merchant request assist warrior improv faction team friend lay wast enemi local onlin co op reap great reward,1,0,0,0,0,0,0,0,0,1,fight,alcohol refer mild languag mild suggest theme violenc
201,2138398,1.21831E+12,Mayhem 3D,0,39.99,39.99,1,1,0,0,Shipping: Not available,3/22/2011,,race finish,Zoo Games,0,E10+=Everyone 10+,grip wheel foot slam acceler eye dart oppon left right ignor bang metal enemi dislodg bumper nonchal gaze past shatter glass windshield oh forget gape hole passeng side door big deal race win whether finish one piec 12 there one goal one goal mayhem fill cours victori get behind wheel one 120 differ vehicl beat smash race til can't race high speed competit matter pretti car look win mayhem 3d combin high octan adrenalin car destruct action american style demolit derbi uk style banger race bring cours like never experi hazard obstacl fierc rivalri two classic race tradit full 3d arcad style game whip 20 level five challeng arena take friend head head split screen car beat tri four differ game mode new challeng play safe far long time let loos make littl mayhem,1,0,0,0,0,1,0,0,0,0,race,violenc
202,2141045,1.21831E+12,Rango,0,14.5,14.5,,,0,0,Shipping: Not available,3/1/2011,,becom greatest sheriff clean town dirt,Paramount Digital Entertainment,0,E10+=Everyone 10+,town dirt could use clean it'll take one tough scale reptil job rango newest sheriff town pint size cowboy big time courag cap patrol wild west atop roadrunn desert bat littl lizard readi action action he'll encount alien threaten abduct rogu rodent let loos wacki mishap ensu sheriff shoot em brawl bad guy save day color wild west world hit movi spring life rango xbox 360 turn shine spur blaze gun prove take wear sheriff badg lead lizard rowdi adventur play rango perform death defi feat race desert wild chase hone shoot skill old fashion shoot town full color charact rang mariachi bird wild rabbit right lizard take place sheriff offic keep dirt spic span free troubl,1,0,0,0,0,1,0,0,0,0,action adventur,cartoon violenc mild languag
203,2146641,1.21831E+12,Portal 2,0,29.99,29.99,16,4.9,1,0,Shipping: Not available,4/19/2011,0,open door new challeng,Valve,1,E10+=Everyone 10+,lie threshold new world ultim adventur ultim challeng world must think act plan everi move outsmart way devious chamber game mental abil best mean surviv follow critic acclaim footstep origin portal new campaign open door mind test puzzl immers stori never seen environ throw new obstacl path brave enough enter rejoin glado occasion murder comput companion guid origin game explor new test chamber portal 2 advanc game physic intric storylin origin music immers fulli ever addict gameplay made famous 2007 game year portal explor excit new area within apertur scienc lab cooper accomplic total uniqu two player campaign mode get readi reconsid everyth thought knew portal success requir act think skill,1,0,0,0,0,1,0,0,0,0,puzzl card,fantasi violenc mild languag
204,2173065,1.21831E+12,Batman: Arkham City,0,39.99,39.99,70,4.9,1,1,Shipping: Usually leaves our warehouse in 1 business day,10/18/2011,0,dark knight return epic follow,WB Games,1,T=Teen,night fall gotham seedi undergrowth citi emerg batman wait ever vigil dark knight monitor citi protect high gritti street one know deepest secret except dr hugo strang gotham crimin insan vile villain insidi charact confin within wall arkham citi batman must fight ensur true ident remain hidden citizen vow protect dark knight return gotham follow popular arkham asylum batman arkham citi soar insid heavili fortifi wall gotham new maximum secur home explor new world five time larger asylum glide soar grappl citi engag hand hand combat enemi take advantag batman trademark stealth maneuv experi intens gritti atmospher brand new storylin bring togeth new star cast classic charact menac murder batman univers util array new enhanc gameplay featur put behind mask dark knight like never,0,0,0,1,0,0,0,0,0,1,action adventur,alcohol refer blood mild languag suggest theme use tobacco violenc
205,2173135,1.21831E+12,Disney/Pixar Cars 2,0,29.99,29.99,2,4.5,1,1,Shipping: Usually leaves our warehouse in 1 business day,6/21/2011,0,buckl seat belt full throttl adventur,Disney Interactive Studios,1,E10+=Everyone 10+,race combat yes even talk they'r favorit wacki wonder wheel they'r back tear road around world new adventur car 2 quirki charact car race back xbox 360 pedal push speedomet bust engin revv fun ever steer success speed spi skid way becom fastest dare racecar world shake rust get gear full throttl challeng car 2 time train wheel becom newest agent chrome command headquart recon oper motor espionag there road danger mission action pack combat ahead enough courag fuel tank get behind wheel favorit car charact mater lightn mcqueen choos newli introduc finn mcmissil holli shiftwel race becom fastest racecar world unleash slick drive skill car charact like drive backward air trick two wheel drive sidestep avoid obstacl world disney pixar car 2 speed ticket one way ticket high speed fun,0,0,0,1,0,1,0,0,0,0,race,cartoon violenc
214,2202037,1.21831E+12,Deus Ex: Human Revolution Augmented Edition,0,29.99,29.99,2,4.5,0,0,Shipping: Not available,8/23/2011,,unravel grim conspiraci brink revolut,Square Enix,0,M=Mature,lurch ahead distant incred unsettl futur futur everyday peopl morph super enhanc be futur dark secret lurk beneath vein america futur might lead someth even wors adam jensen thought work good guy handpick protect advanc biotechnolog firm design plan keep top scientist safe help countri thought black op team burst firm massacr scientist initi dark plot use plan design weari world teeter edg sinist conspiraci threaten twist evolut human race adam jensen person uncov plot stop revolut late deus ex human revolut augment edit transport turn point human ventur way one pair game experi futur grip motion graphic novel 40 page art book behind scene dvd enter world scienc technolog human intersect seiz power decid outcom human race becom adam jensen rich deepli imagin rpg immers combin realist first person combat drag futur battl thug special oper soldier robot threaten journey life incred opportun enhanc charact stealth social hack combat skill empow struggl bewar everi decis make consequ affect entir human race stop conspiraci grim revolut forev chang world know,1,0,0,0,0,0,0,1,0,0,shooter,blood drug refer intens violenc sexual theme strong languag use alcohol
215,2212043,1.21831E+12,Skylanders: Spyro's Adventure Starter Pack,0,69.99,69.99,7,4.9,1,1,Shipping: Usually leaves our warehouse in 1 business day,10/16/2011,0,unlock portal power,Activision,1,E10+=Everyone 10+,generat skyland use magic power weaponri protect skyland evil forc howev malici tyrant risen take skyland frozen banish earth portal master abil place skyland portal power bring back life save skyland forev portal master control pathway world magic be come form toy figurin 30 differ charact includ spyro dragon beck call regain prosper beyond portal power get know interact figur master abil learn strength har power individu element togeth stand chanc defeat evil kao clench land devast stronghold adventur bewar order make battl mani outlandish creatur solv mani challeng puzzl luckili go cours alon enlist friend help along way work togeth overcom obstacl tandem starter pack skyland spyro adventur receiv everyth need begin adventur vivid world featur three uniqu skyland charact interact figur includ spyro gill grunt trigger happi portal power starter pack bring favorit skyland life world explor varieti landscap peril pastur spooki cadaver crypt discov mysteri fantast land encount new friend battl terrifi creatur overcom challeng solv puzzl collect treasur quest hold key fascin danger toy world that anyth child play readi open door,0,0,0,1,0,1,0,0,0,0,action adventur,cartoon violenc
216,2248278,1.21832E+12,Transformers: Dark of the Moon,0,39.99,39.99,1,5,1,0,Shipping: Not available,6/14/2011,0,transform epic hero vehicular villain,Activision,0,T=Teen,three year chill event transform reveng fallen world lull time peac megatron decepticon longer pose threat innoc breath easili would seem beneath surfac threat darker danger ever breed arm dead assassin shockwav megatron return earth stronger determin complet destroy autobot new home planet transform battlefield vehicular proport take front line prepar fight life epic transform saga continu transform dark moon transport crucial moment grip third instal michael bay blockbust mechan warfar seri fend megatron decepticon latest attack take battlefield autobot combin jet car truck charact chassi uniqu weapon loadout arm quest hungri tast evil switch decepticon side tri villaini size take battl onlin earn xp level charact bring closer save world destroy get readi transform idea battl,1,0,0,0,0,0,0,0,0,1,action adventur,violenc
217,2281794,1.21832E+12,Dance Dance Revolution,0,29.99,29.99,,,1,0,Shipping: Not available,4/12/2011,0,danc drop retro favorit,Konami,0,E10+=Everyone 10+,master move becom king queen mall arcad mayb dream impress friend crush slick ddr skill 11 year danc danc revolut rule parti domin arcad scene captur heart feet aspir groover around world origin game got bodi move puls pound back better ever xbox 360 burst back live room intens challeng awesom song like ladi gaga bad romanc jordin spark battlefield danc danc revolut take world danc simul next level get entir bodi game onto screen includ control xbox live camera work togeth captur danc move display onscreen turn live room danc club move stream 20 song nonstop feel competit challeng friend danc see who got move realli heat floor,1,0,0,0,0,1,0,0,0,0,music danc parti,mild lyric suggest theme
222,2284728,1.21832E+12,"Carnival Games: Monkey See, Monkey Do",1,29.99,29.99,10,3.9,1,0,Shipping: Not available,4/5/2011,0,step right carniv parti style fun,2K Play,0,E=Everyone,ladi gentlemen boy girl step right fair share mini game challeng never step action quit like get readi put dancin shoe cotton eye joe competit monkey barker dive danger shark tank go reel ride gold rush mountain rowdi charact hilari prize bodi test challeng carniv come live room new adventur whole famili carniv game monkey see monkey invit midway parti style fun use whole bodi design exclus take full advantag full bodi motion sens control kinect 20 rip roar game color collect challeng climb right action fling ring pop dart test strength spin wheel chanc load new classic boardwalk favorit prove midway might take home interact prize crazi mom dad may let hous best hold onto dragon robot cowboy fli bear ninja wacki wearabl earn,1,0,0,0,0,0,1,0,0,0,action adventur,na
223,2319319,1.21832E+12,Dungeon Siege III,0,29.99,29.99,4,4.3,1,1,Shipping: Usually leaves our warehouse in 1 business day,6/21/2011,0,answer plea help,Square Enix,1,T=Teen,centuri nation ehb protect kept safe brave virtuous legionnair betray driven brink extinct evil rear ugli head ehb peopl turn last legionnair protect heir legion step defend nation fight hord sinist danger creatur use varieti weapon special move magic order succeed accept peopl plea help choos play one four class guardian archon lescanzi scholar defend nation ehb evil dungeon sieg iii along way use arsenal weapon special move magic abil defeat nefari creatur enjoy cooper multiplay action connect onlin gather friend play togeth split screen excit summon braveri courag time face decis make watch decis direct impact stori environ blend intuit fast pace gameplay rich storylin larg select abil dungeon sieg iii immers world ehb like never,0,0,0,1,0,0,0,0,0,1,role play,blood mild languag mild suggest theme violenc
224,2330703,1.21832E+12,Saints Row: The Third,0,49.99,49.99,34,4.5,1,1,Shipping: Usually leaves our warehouse in 1 business day,11/15/2011,0,saint bless street steelport vengeanc,THQ,1,M=Mature,stir street stilwat becam new king town citi steelport get rust saint take fight syndic turf biggest outlandish chapter epic gang war date rejoin rank unholi saint around return row experi gang life post fame kid kick around saint sneaker tough guy hope slurp saint energi drink storeown proud display johnni gat bobbl head top shelv celebr status hit saint surviv newfound glori unscath saint row third fame fortun come bittersweet price king stilwat face serious demand legendari crimin fratern syndic saint must hit street steelport trampl new rival defend status get readi intens action gruel gang violenc outlandish situat spare take decay citi sin new battl saint buckl take massiv tank wild ride sky duke train militari forc call strateg airstrik mexican wrestl gang grit gut galor gang never kneel enemi saint mean behav,0,0,0,1,0,0,0,1,0,0,action adventur,blood gore drug refer intens violenc partial nuditi sexual content strong languag
225,2340293,1.21832E+12,NCAA Football 12,0,29.99,29.99,16,3.6,1,0,Shipping: Not available,7/12/2011,0,go back school biggest colleg footbal action yet,EA SPORTS,1,E=Everyone,saturday day work day sleep day kick back saturday train week day defin whether celebr new hero campus biggest letdown town day heat rival laid rest trampl pride game day fierc world colleg footbal game way life take go back school bring glori campus field climb school color hit stadium authent colleg footbal experi yet ncaa footbal 12 year tradit intens celebr rowdier school pride never real live pain glori action grit saturday day week take competit 50 yard line fiercest rival deliv punish hit devast tackl new momentum base collis tackl system let control player moment impact experi true emot colleg footbal new pre game tradit includ sooner schooner ramblin wreck celebr exhilar play school specif icon like chief osceola uga tommi trojan take challeng run program enhanc dynasti mode let begin coach career coordin take head coach rise rank lead school covet nation championship forev alter landscap colleg footbal realign confer construct new 16 team super confer make impact field lead team road nation championship learn old school footbal glori realli mean,1,0,0,0,0,0,1,0,0,0,sport outdoor,na
226,2375195,1.21832E+12,Madden NFL 12,0,39.99,39.99,26,3.4,1,1,Shipping: Usually leaves our warehouse in 1 business day,8/30/2011,0,live action sunday everi day week,EA SPORTS,1,E=Everyone,decad one name defin nfl game authent footbal immers rich strategi emot raw aggress encapsul nfl name madden matter color paint face game day fan know turn intric playbook accur render player intens rivalri matchup everyth els see sunday lower shoulder prepar experi bone crunch hit scrambl loos ball puls pound rush fight everi yard feel inexplic high burst line 40 yard dash intercept pass get star receiv get readi immers excit nfl action step center madden nfl 12 experi grit immediaci come expect revolutionari seri lace new season prove team rise gridiron glori madden nfl 12 break huddl purpos read field line scrimmag domin oppon get readi gritti uncompromis pro footbal experi that better ever get closer nfl action ever latest game authent madden yet boast complet overhaul present includ 32 nfl team specif run out cheerlead mascot 500 dynam broadcast camera authent stadium field camera shot expert nfl film cameramen new network inspir broadcast graphic packag madden nfl 12 let experi game day like never maintain full control player point impact feel realist hit franchis histori new collis system use player momentum 100 tackl anim includ gang tackl deliv authent hit tackl collis prepar smartest madden defens ever featur 100 defens ai enhanc allow player read react play fli know player role field prepar fourth quarter new dynam player perform show player perform end game kickoff player becom indispens string togeth seri big play complet lose confid drop pass fumbl 32 nfl team stadium favorit player madden nfl 12 true game,0,0,0,1,0,0,1,0,0,0,sport outdoor,na
232,2396097,1.21833E+12,Rio,0,19.99,19.99,1,5,1,1,Shipping: Usually leaves our warehouse in 1 business day,4/12/2011,0,soar color adventur street rainforest tropic,THQ,1,E10+=Everyone 10+,may littl blu rare domest bird time life fli coop discov new world beyond birdcag citi bird wisecrack smooth talk street aliv soccer game spici music rainforest lush conga line move fast blu perch citi rio life never get readi strut stuff shake tail feather take wing soar color music total bird iful adventur join blu jewel flock feisti feather friend adventur realli make molt action music hilar hit 3d comedi come life dive 40 high fli mini game blu gang rio gather friend compet take first place carnav award ceremoni play favorit charact includ blu jewel pedro raphael nico eva strut street rio catch ray copacabana beach journey rainforest explor world movi ton action pack game play way tri uniqu challeng stori parti carnav carnav wheel garland gala mode prove come adventur big citi top feather,0,0,0,1,0,1,0,0,0,0,action adventur,comic mischief mild cartoon violenc
233,2432045,1.21833E+12,MX vs. ATV Alive,0,19.99,19.99,3,2.3,1,0,Shipping: Not available,5/10/2011,0,ventur road intens motocross action,THQ,0,E=Everyone,condit muddi tire churn splatter earth everi tight curv hug leav decis trail behind throttl ahead jump rise track ahead grip handlebar tighter smile wide beneath face mask playtim acceler ahead spring attack posit let go handlebar altogeth soar air perfect land rider 7 come view competitor ahead plow around insid line bang bar edg track way wobbl fight regain balanc seiz moment inch much closer checker flag parad lap get readi get dirti take path less travel mx vs atv aliv advanc authent face motocross experi lead road franchis date dirt fli puls pound world competit race truli come aliv live room first time choos mode choos track possess power add even love extra download content pull helmet best rider industri suit best licens gear get behind handlebar power mx machin atv gate checker flag show competitor own terrain bang bar nail stunt control bike enhanc rider reflex take ride road race motocross championship get readi go big go home,1,0,0,0,0,0,1,0,0,0,race,mild languag mild suggest theme mild violenc
234,2432142,1.21833E+12,Kung Fu Panda 2,0,39.99,39.99,,,1,1,Shipping: Usually leaves our warehouse in 1 business day,5/24/2011,0,panda monium bigger ever,THQ,1,E10+=Everyone 10+,may look cute cudd alreadi know po panda pack major martial art punch everi sens word cours gongman citi face fresh threat ruthless new villain includ baddest jungl anim ever meet black white wonder hero everyon look bear er restor peac safeti across land thought karat chop roundhous kick kung fu fight get bigger fearsom warrior buddi furious five back even frenet mayhem lot laugh along way kung fu panda 2 base excit sequel origin blockbust anim movi game featur familiar friend enemi well new twist turn help power po defeat devious xaio dan overcom danger obstacl conquer feroci foe path maintain status fast lightn kung fu fighter kick punch chop way victori gongman citi po join master shifu croc ox whole furious five gang new adventur start final battl kung fu panda 2 movi master signatur kung fu fight style take loot wolv power gorilla clan barbar komodo dragon threaten peac citi combin panda prowess problem solv strategi sure go far battlefield thrill gameplay design motion sens capabl xbox 360 grip new storylin take deep latest movi beyond epic sequel bring martial art mad life like never get readi adventur that big great wall whole lot panda monium fight way kung fu glori,0,0,0,1,0,1,0,0,0,0,action adventur,cartoon violenc
